<?xml version="1.0" encoding="UTF-8" standalone="yes"?>
<document xmlns="http://pavelfatin.com/sleeparchiver" xmlns:xsi="http://www.w3.org/2001/XMLSchema-instance" version="1.0" xsi:schemaLocation="http://pavelfatin.com/sleeparchiver http://pavelfatin.com/files/sleeparchiver/document.xsd">
    <night date="2005-02-04" alarm="08:45" window="30" toBed="22:15" easeOfFallingAsleep="hard" qualityOfSleep="good" easeOfWakingUp="normal" alarmWorked="true" comments="Foo comment">
        <moments>
            <moment>23:30</moment>
            <moment>03:00</moment>
            <moment>08:30</moment>
        </moments>
        <conditions>
            <condition>Condition A</condition>
            <condition>Condition B</condition>
        </conditions>
    </night>
    <night date="2006-03-05" alarm="09:55" window="20" toBed="23:15" easeOfWakingUp="hard">
        <moments>
            <moment>23:40</moment>
            <moment>05:00</moment>
            <moment>09:10</moment>
        </moments>
        <conditions>
            <condition>Condition D</condition>
            <condition>Condition B</condition>
            <condition>Condition E</condition>
        </conditions>
    </night>
</document>
